{
  "meta": {
    "id": "factory",
    "name": "异常工厂流水线",
    "subtitle": "MINIGAME · ANOMALY FACTORY SIM"
  },
  "monitor": {
    "initial": "监控画面稳定：1 号工段传送带运转正常。产出计数稳定。",
    "actions": {
      "openDoor": "监控：{floor} 号工段传送带已启动。轴承运转声音异常。",
      "closeDoor": "监控：{floor} 号工段传送带停止。机器惯性余转 2 秒。",
      "moveUp": "监控：流水线加速至正向高速。{floor} 号工段传感器过载。",
      "moveDown": "监控：流水线减速至反向低速。{floor} 号工段指示灯闪烁。",
      "emergencyStop": "监控：全线急停。所有传送带制动器动作。灯光熄灭。",
      "restartSystem": "监控：系统重启后恢复画面。部分工控数据帧丢失。"
    }
  },
  "actionLabels": {
    "openDoor": "启动传送带", "closeDoor": "停止传送带", "moveUp": "加速生产", "moveDown": "减速生产",
    "emergencyStop": "全线急停", "restartSystem": "系统复位", "inspectLog": "查看工控日志",
    "unlockHiddenLog": "解码加密记录"
  },
  "doorLabels": { "open": "运转", "closed": "停止" },
  "directionLabels": { "up": "正向", "down": "反向", "idle": "待机" },
  "statusLabels": {
    "panelTitle": "产线状态",
    "floor": "工段",
    "door": "线体",
    "direction": "方向",
    "passengers": "产线人员",
    "power": "电力",
    "stability": "线体稳定",
    "anomalyLevel": "故障等级",
    "reviveCount": "广告维修",
    "adHintsCount": "加密解码",
    "hiddenLogsCount": "待解码"
  },
  "canvasLabels": {
    "countdown": "值守倒计时",
    "monitorPanel": "产线监控",
    "actionPanel": "工控操作",
    "logPanel": "工控日志",
    "forceAnomaly": "触发产线异常",
    "failureTitle": "产线系统崩溃",
    "failureEyebrow": "FACTORY FAILURE",
    "monitorSignalStable": "SIGNAL: NOMINAL",
    "monitorSignalUnstable": "SIGNAL: UNSTABLE",
    "monitorSignalCorrupted": "SIGNAL: OVERLOAD",
    "monitorThreat": "FAULT: {level}",
    "failureMetricStability": "稳定",
    "failureMetricAnomaly": "故障",
    "failureMetricRemaining": "剩余"
  },
  "actionFailMessages": {
    "openDoor_moving": "传送带运行中，禁止重新启动。",
    "moveUp_doorNotClosed": "传送带未停止，禁止调节速度。",
    "moveDown_doorNotClosed": "传送带未停止，禁止调节速度。",
    "unknownAction": "未知工控操作：{actionId}",
    "gameOver": "产线系统已崩溃，必须呼叫维修支援或重新投产。"
  },
  "actionFeedback": {
    "openDoor": "传送带已启动。", "closeDoor": "传送带已停止。",
    "moveUp": "生产线加速中。", "moveDown": "生产线减速中。",
    "emergencyStop": "全线急停已执行。", "emergencyStop_fail": "急停按钮失效。", "restartSystem": "系统复位完成。",
    "inspectLog": "已查看工控日志。",
    "unlockHiddenLog_noLocked": "没有待解码的加密记录。",
    "unlockHiddenLog_limit": "本局已解码 {count} 条记录，达到上限。"
  },
  "actionLogMessages": {
    "openDoor": "{floor} 号工段传送带已启动。",
    "closeDoor": "{floor} 号工段传送带已停止。",
    "moveUp": "生产线加速生产，当前工段 {floor}。",
    "moveDown": "生产线减速生产，当前工段 {floor}。",
    "emergencyStop": "执行全线急停：所有工段停止，线体稳定度下降。",
    "emergencyStop_fail": "急停按钮无响应。故障等级上升。",
    "restartSystem": "系统复位完成：故障等级下降，但消耗 {cost} 点电力。",
    "inspectLog": "操作员查看工控日志：最近 30 秒存在未授权速度调节请求。",
    "inspectLog_hiddenRecords": "发现 {count} 条待解码加密记录。可观看模拟广告解锁完整内容。",
    "unlockHiddenLog_ok": "模拟广告播放完成。加密记录已解码。"
  },
  "anomalies": [
    {
      "id": "phantom_floor", "title": "不存在的工段", "severity": 2,
      "monitor": "监控：传送带停在 Z-13 号工段。车间图纸中不存在该工段。",
      "adHint": "遇到未知工段时，不要启动传送带，先执行系统复位。",
      "effects": { "floor": 13, "anomalyLevel": 2, "stability": -10 }
    },
    {
      "id": "camera_delay", "title": "传感器信号延迟", "severity": 1,
      "monitor": "监控：传感器信号延迟 3 秒。机械动作与控制系统不同步。",
      "adHint": "信号延迟时优先查看日志，不要连续调节速度。",
      "effects": { "anomalyLevel": 1, "stability": -6 }
    },
    {
      "id": "zero_passenger_shadow", "title": "产出计数为 0 但机器仍在运转", "severity": 2,
      "monitor": "监控：传送带正常运转，但产出计数器显示 0。机械运转声持续。",
      "adHint": "产出异常时保持传送带停止，先急停再查日志。",
      "effects": { "passengers": 0, "anomalyLevel": 2, "stability": -12 }
    },
    {
      "id": "log_echo", "title": "警报日志重复", "severity": 1,
      "monitor": "监控：工控日志持续输出\\u201c不要加速\\u201d。",
      "adHint": "日志重复通常是轻度异常，系统复位可降低故障等级。",
      "effects": { "anomalyLevel": 1, "stability": -5 }
    },
    {
      "id": "auto_button", "title": "传送带自动启动", "severity": 2,
      "monitor": "监控：没有操作员指令，B2 与 9 号工段传送带自动运转。",
      "adHint": "传送带自动启动时不要跟随操作，先停止并执行急停。",
      "effects": { "anomalyLevel": 2, "power": -8 }
    },
    {
      "id": "stop_failure", "title": "急停按钮失效", "severity": 3,
      "monitor": "监控：急停按钮指示灯熄灭，控制台拒绝确认安全回路。",
      "adHint": "急停失效时不要反复点击，优先系统复位。",
      "effects": { "anomalyLevel": 3, "stability": -15 }
    },
    {
      "id": "negative_floor", "title": "工段编号显示异常", "severity": 2,
      "monitor": "监控：工段编号显示 -1。监控画面出现废弃地下产线。",
      "adHint": "异常编号工段不可操作，立即执行系统复位。",
      "effects": { "floor": -1, "anomalyLevel": 2, "stability": -10 }
    },
    {
      "id": "power_drain", "title": "电力异常消耗", "severity": 2,
      "monitor": "监控：备用发电机自动启动，但电网负载仍在上升。",
      "adHint": "电力异常时减少生产调度，优先停止所有传送带并复位。",
      "effects": { "anomalyLevel": 2, "power": -22 }
    },
    {
      "id": "door_refuse", "title": "传送带拒绝停止", "severity": 2,
      "monitor": "监控：停止按钮已按下，传送带在停转前自动恢复运转。异常状态持续。",
      "adHint": "传送带拒绝停止时不要连续操作，先急停再系统复位。",
      "effects": { "door": "open", "anomalyLevel": 2, "stability": -10 }
    },
    {
      "id": "weight_mismatch", "title": "产出数据矛盾", "severity": 1,
      "monitor": "监控：产出计数器归零。传送带仍在运送成品。读数矛盾。",
      "adHint": "产出数据矛盾时优先查日志，计数可能被重置。",
      "effects": { "passengers": 0, "anomalyLevel": 1, "stability": -7 }
    },
    {
      "id": "floor_jump", "title": "工段编号跳变", "severity": 2,
      "monitor": "监控：传送带从 5 号工段直接跳到 9 号工段。监控画面缺失 4 帧。",
      "adHint": "工段跳变时暂停生产调度，用系统复位恢复工段显示。",
      "effects": { "floor": "+4", "anomalyLevel": 2, "stability": -12, "power": -10 }
    },
    {
      "id": "emergency_lights", "title": "应急灯异常启动", "severity": 3,
      "monitor": "监控：车间应急灯突然亮起。备用电源消耗加速。",
      "adHint": "应急灯启动时暂停生产，立即系统复位可关闭应急模式。",
      "effects": { "anomalyLevel": 3, "stability": -14, "power": -20 }
    }
  ],
  "hiddenLogs": {
    "phantom_floor": { "title": "Z-13 工段建设记录", "content": "建设记录 #F-13：Z-13 工段在投产前被从生产线图纸中删除。\\n原因：调试期间发生 III 级安全事故，3 名工人失踪。\\n该工段控制面板已被物理拆除，但传感器仍能检测到设备运转信号。" },
    "camera_delay": { "title": "传感器校准记录", "content": "校准日志 #S-4417：速度传感器 #03 与 #07 存在 3 秒信号延迟。\\n技术员备注：延迟与 Z-13 工段电磁干扰有关，建议不要启动该工段传送带。" },
    "zero_passenger_shadow": { "title": "产出计数器异常说明", "content": "设备手册（节选）：\\n光电计数器在夜班多次检测到零件通过信号，但产出计数持续归零。\\n维修记录：传感器无故障。通过信号波形经分析——与任何已知零件规格不匹配。" },
    "log_echo": { "title": "工控系统诊断报告", "content": "诊断报告 #FD-22-019：\\n工控日志缓冲区检测到重复写入操作。重复内容「不要加速」的写入时间戳早于当前值班员登录时间。\\n建议：检查前一值班员的退出状态。" },
    "auto_button": { "title": "PLC 控制系统审计", "content": "审计追踪 #AUD-882：\\n传送带自动启动信号来源追溯至 5 号 PLC（已于 2022 年停用）。\\n该 PLC 的最后一条记录：「控制权移交程序未完成」。" },
    "stop_failure": { "title": "急停系统维护日志", "content": "维护日志 #M-341：\\n急停回路 #2 在定期检查中被标记为「状态：不可用」。\\n签署人签名无法识别。签署时间：3 年前。没有后续维修记录。" },
    "negative_floor": { "title": "地下产线勘测报告", "content": "工厂勘测报告（内部）：\\n地下实际存在 4 层废弃产线，但公开图纸仅标注 B1-B2。\\nB3-B4 产线的控制面板在停产时已被拆除，但动力线路仍然通电。" },
    "power_drain": { "title": "备用电源异常报告", "content": "异常报告 #P-877：\\n备用发电机在无负载状态下持续运行。经查，有一条非授权线路从配电柜分接至未知设备。\\n线路标签：「不要切断」。" },
    "door_refuse": { "title": "传送带控制系统报告", "content": "故障报告 #D-1290：\\n传送带驱动模块在连续 3 次异常停机后进入保护模式。\\n模块日志输出最后一条：「识别到外部干扰信号。拒绝执行 — 保护设备安全」。" },
    "weight_mismatch": { "title": "传感器校验记录", "content": "校验记录 #W-554：\\n产出计数器与重量传感器读数不一致。重量传感器在空载时检测到负载信号。\\n技术员备注：请确认值班员在轮班前已清空传送带。" },
    "floor_jump": { "title": "工段定位日志", "content": "定位日志 #F-213：\\n工段编码器在校准前后报告的编号不一致。\\n系统自动修正失败。可能原因：参考信号源来自非标设备。" },
    "emergency_lights": { "title": "应急照明测试报告", "content": "测试报告 #E-777：\\n应急照明系统在无触发信号情况下自行启动。\\n供电线路检测到寄生回路。回路终端设备编号在资产清单中不存在。" }
  },
  "failure": {
    "summaries": { "power": "电力耗尽", "stability": "线体稳定度归零", "anomalyLevel": "故障等级失控", "passengers": "产出数据异常", "default": "系统拒绝继续响应" },
    "defaultHint": "先停止所有传送带，再执行系统复位。",
    "adHintPrefix": "维修提示：{hint}",
    "adReviveRollback": "呼叫维修支援完成：回滚 {seconds} 秒，恢复至可控状态。",
    "adReviveMonitor": "呼叫维修支援完成：回滚到 {seconds} 秒前的系统状态。",
    "snapshotFallback": "可呼叫维修支援，回滚到 {seconds} 秒前的系统状态。",
    "noSnapshotFallback": "可呼叫维修支援，回滚到初始系统状态。"
  },
  "fakeEnding": {
    "eyebrow": "\\u26a0 SYSTEM ANOMALY DETECTED",
    "title": "操作员关联异常",
    "text": "系统检测到操作员第 {count} 次产线崩溃。\\n根据《异常控制员守则》第 7 条，您已被标记为\\u201c异常关联人员\\u201d。\\n前 {threshold} 次记录已被永久删除。\\n建议您立即离开控制室并联系安全部门。",
    "truthPlaceholder": "[???] 观看广告揭示真相。",
    "truthContent": "这不是第一次，也不会是最后一次。\\n这座工厂的异常系统从未被修复。\\n每一任操作员最后都变成了「设备故障」本身。\\n产出数据中关于「成品」的记载——都是前任操作员的生物信号。\\n你现在坐的位置，就是上一任操作员被发现的地方。"
  },
  "ui": {
    "viewAd": "呼叫维修支援",
    "unlockAd": "解码加密记录",
    "restart": "重新投产",
    "revealTruth": "观看广告揭示真相",
    "triggerTest": "触发故障测试",
    "decodePrefix": "[解码记录]",
    "initialLog": "异常工厂控制系统已接管。等待操作员指令。",
    "anomalyEventLog": "产线异常：{title}。{hint}",
    "startTitle": "等待接管产线中控",
    "startCopy": "目标：值守 60 秒，观察产线监控、处理工控异常、避免生产系统崩溃。接管后倒计时才会启动。",
    "startChecklist": "先读产线监控和工控日志\n异常出现时按提示执行操作\n失败后可通过远程支援复活",
    "startFailureRulesTitle": "停线条件",
    "startFailureRules": "主电源归零\n产线稳定度归零\n异常等级失控",
    "startButton": "接管产线值守",
    "successfulShift": "本轮值守结束。产线系统仍未解释全部异常。",
    "shiftComplete": "值守完成。连续失败计数已重置。",
    "hiddenLogCaptured": "加密记录已捕获：{title}。使用「查看工控日志」功能解码。",
    "unlockResult": "已解码：{title}",
    "decodeMonitor": "解码完成：{title}。完整内容已写入工控日志。"
  }
}
